{
  "event_name": "transcript-finished",
  "key": "0c2d1a64-5d0e-4c3f-9b7a-2f5e8d9c1a11",
  "room_name": "[acme]6f1c2b9e-4a77-4f0e-9a1e-2c1f9a7d1b33",
  "room_jid": "[acme]6f1c2b9e-4a77-4f0e-9a1e-2c1f9a7d1b33@muc.meet.jitsi",
  "meeting_id": "0c2d1a64-5d0e-4c3f-9b7a-2f5e8d9c1a11",
  "is_breakout": false,
  "language": "bn",
  "created_at": 1791100990,
  "destroyed_at": 1791104610,
  "truncated": false,
  "line_count": 2,
  "lines": [
    {
      "id": "3f8e2a1c-7b4d-4e6f-9a0b-1c2d3e4f5a6b",
      "user_id": "8891",
      "name": "Alex Example",
      "language": "bn",
      "start_ms": 1791101061230,
      "end_ms": 1791101066010,
      "text": "আজকে আমরা photosynthesis নিয়ে কথা বলব।"
    },
    {
      "id": "9a7b6c5d-4e3f-4a2b-8c1d-0e9f8a7b6c5d",
      "user_id": "8892",
      "name": "Sam Example",
      "language": "bn",
      "start_ms": 1791101070100,
      "end_ms": 1791101072900,
      "text": "স্যার, একটা প্রশ্ন ছিল।"
    }
  ]
}
